{
  "version": "0.1.0",
  "ageBand": { "min": 6, "max": 9 },

  "tiers": [
    {
      "id": "t1",
      "order": 1,
      "title": "Meet the board",
      "goal": "Your child can name every square and move every piece legally."
    },
    {
      "id": "t2",
      "order": 2,
      "title": "Playing a real game",
      "goal": "Your child can play a full legal game start to finish, including castling and checkmate.",
      "unlocksAt": { "previousTierUnitsMastered": 1.0 }
    },
    {
      "id": "t3",
      "order": 3,
      "title": "Don't give it away",
      "goal": "Your child stops hanging pieces and starts counting what a trade is worth.",
      "unlocksAt": { "previousTierUnitsMastered": 0.8 }
    },
    {
      "id": "t4",
      "order": 4,
      "title": "Tricks and traps",
      "goal": "Your child can spot forks, pins, and skewers in a real position.",
      "unlocksAt": { "previousTierUnitsMastered": 0.8 }
    },
    {
      "id": "t5",
      "order": 5,
      "title": "Finishing the game",
      "goal": "Your child can deliver checkmate on purpose instead of by accident.",
      "unlocksAt": { "previousTierUnitsMastered": 0.8 }
    },
    {
      "id": "t6",
      "order": 6,
      "title": "The last few pieces",
      "goal": "Your child knows what to do when almost everything is gone.",
      "unlocksAt": { "previousTierUnitsMastered": 0.75 }
    },
    {
      "id": "t7",
      "order": 7,
      "title": "Play and improve",
      "goal": "Your child plays rated games and reviews their own mistakes with the coach.",
      "unlocksAt": { "previousTierUnitsMastered": 0.75 }
    }
  ],

  "units": [
    {
      "id": "t1-u01-light-and-dark",
      "tier": "t1",
      "order": 1,
      "title": "Every square has a colour",
      "concept": "The board alternates light and dark, and the bottom-right square is always light.",
      "estimatedMinutes": 3,
      "readingLevel": "none",
      "activities": [
        {
          "type": "guided_demo",
          "fen": "8/8/8/8/8/8/8/8 w - - 0 1",
          "script": [
            { "say": "This is a chessboard. Sixty-four squares.", "waitForTap": true },
            { "say": "Half of them are light. Half are dark.", "highlight": ["a1", "c1", "e1", "g1"] },
            { "say": "The square in the bottom right corner is always light. Always. Remember that one.", "highlight": ["h1"] }
          ]
        },
        {
          "type": "quiz",
          "questions": [
            { "fen": "8/8/8/8/8/8/8/8 w - - 0 1", "ask": "Tap the bottom right square.", "answerType": "square", "answer": "h1" }
          ]
        }
      ],
      "mastery": { "type": "streak", "streak": 3 },
      "voiceover": {
        "intro": "Let's look at the board before we touch any pieces.",
        "success": "That's it. Light on the right.",
        "hintTier1": "Look at the corner nearest your hand.",
        "retry": "Not that one. Try the other corner."
      }
    },
    {
      "id": "t1-u02-rows-and-columns",
      "tier": "t1",
      "order": 2,
      "title": "Squares have names",
      "concept": "Columns are letters a to h, rows are numbers 1 to 8, and every square has one name like e4.",
      "prerequisites": ["t1-u01-light-and-dark"],
      "estimatedMinutes": 5,
      "readingLevel": "emerging",
      "activities": [
        {
          "type": "guided_demo",
          "fen": "8/8/8/8/8/8/8/8 w - - 0 1",
          "script": [
            { "say": "Columns go up and down. They have letters.", "highlight": ["e1", "e2", "e3", "e4", "e5", "e6", "e7", "e8"] },
            { "say": "Rows go side to side. They have numbers.", "highlight": ["a4", "b4", "c4", "d4", "e4", "f4", "g4", "h4"] },
            { "say": "Where they cross is e4. Letter first, then number.", "highlight": ["e4"] }
          ]
        },
        { "type": "quiz", "questions": [] }
      ],
      "mastery": { "type": "ratio", "ratio": [8, 10] },
      "voiceover": {
        "intro": "Every square has a name. Once you know them, you can talk about chess with anyone in the world.",
        "success": "Found it.",
        "hintTier1": "Find the letter along the bottom first.",
        "hintTier2": "Now slide your finger up to the number."
      }
    },
    {
      "id": "t1-u03-rook",
      "tier": "t1",
      "order": 3,
      "title": "The rook goes straight",
      "concept": "The rook moves any number of squares along a row or column, but never diagonally.",
      "prerequisites": ["t1-u01-light-and-dark"],
      "estimatedMinutes": 5,
      "readingLevel": "none",
      "activities": [
        { "type": "guided_demo", "fen": "8/8/8/8/3R4/8/8/8 w - - 0 1", "script": [] },
        {
          "type": "target_practice",
          "boardSize": 5,
          "piece": "R",
          "obstacles": "none",
          "generator": { "minMoves": 1, "maxMoves": 2, "rounds": 6 }
        },
        {
          "type": "target_practice",
          "boardSize": 8,
          "piece": "R",
          "obstacles": "blockers",
          "generator": { "minMoves": 2, "maxMoves": 3, "rounds": 6 }
        }
      ],
      "mastery": { "type": "streak", "streak": 5 },
      "voiceover": {
        "intro": "The rook is the castle tower. It only likes straight lines.",
        "success": "Straight there.",
        "hintTier1": "Rooks can't go diagonally. Try along the row or the column.",
        "retry": "That's a diagonal. The rook can't do that one."
      }
    },
    {
      "id": "t1-u04-bishop",
      "tier": "t1",
      "order": 4,
      "title": "The bishop stays on its colour",
      "concept": "The bishop moves diagonally, which means it can never leave the colour it started on.",
      "prerequisites": ["t1-u03-rook"],
      "estimatedMinutes": 5,
      "readingLevel": "none",
      "activities": [
        { "type": "guided_demo", "fen": "8/8/8/8/3B4/8/8/8 w - - 0 1", "script": [] },
        {
          "type": "target_practice",
          "boardSize": 5,
          "piece": "B",
          "obstacles": "none",
          "generator": { "minMoves": 1, "maxMoves": 2, "rounds": 6 }
        }
      ],
      "mastery": { "type": "streak", "streak": 5 },
      "voiceover": {
        "intro": "The bishop only moves on slants. Watch what that means.",
        "success": "Nice slant.",
        "hintTier1": "Look at the colour your bishop is standing on. It can only reach that colour.",
        "retry": "That square is the wrong colour for this bishop."
      }
    },
    {
      "id": "t1-u05-queen",
      "tier": "t1",
      "order": 5,
      "title": "The queen does both",
      "concept": "The queen moves like a rook and a bishop combined.",
      "prerequisites": ["t1-u04-bishop"],
      "estimatedMinutes": 4,
      "readingLevel": "none",
      "activities": [
        { "type": "guided_demo", "fen": "8/8/8/8/3Q4/8/8/8 w - - 0 1", "script": [] },
        {
          "type": "target_practice",
          "boardSize": 8,
          "piece": "Q",
          "obstacles": "blockers",
          "generator": { "minMoves": 2, "maxMoves": 3, "rounds": 8 }
        }
      ],
      "mastery": { "type": "streak", "streak": 5 },
      "voiceover": {
        "intro": "You already know the queen. She's a rook and a bishop in one.",
        "success": "The queen goes anywhere.",
        "hintTier1": "Straight lines or slants. Both work."
      }
    },
    {
      "id": "t1-u06-knight",
      "tier": "t1",
      "order": 6,
      "title": "The knight hops",
      "concept": "The knight moves in an L and jumps over anything in the way.",
      "prerequisites": ["t1-u03-rook"],
      "estimatedMinutes": 8,
      "readingLevel": "none",
      "activities": [
        { "type": "guided_demo", "fen": "8/8/8/8/3N4/8/8/8 w - - 0 1", "script": [] },
        {
          "type": "target_practice",
          "boardSize": 5,
          "piece": "N",
          "obstacles": "none",
          "generator": { "minMoves": 1, "maxMoves": 1, "rounds": 6 }
        },
        {
          "type": "target_practice",
          "boardSize": 5,
          "piece": "N",
          "obstacles": "none",
          "generator": { "minMoves": 2, "maxMoves": 2, "rounds": 6 }
        },
        {
          "type": "target_practice",
          "boardSize": 8,
          "piece": "N",
          "obstacles": "blockers",
          "generator": { "minMoves": 2, "maxMoves": 3, "rounds": 8 }
        }
      ],
      "mastery": { "type": "streak", "streak": 5 },
      "voiceover": {
        "intro": "The knight is the strange one. It jumps.",
        "success": "Good hop.",
        "hintTier1": "Two squares one way, then one square to the side.",
        "hintTier2": "The knight always lands on the opposite colour to where it started."
      }
    },
    {
      "id": "t1-u07-king",
      "tier": "t1",
      "order": 7,
      "title": "The king takes one step",
      "concept": "The king moves one square in any direction.",
      "prerequisites": ["t1-u05-queen"],
      "estimatedMinutes": 3,
      "readingLevel": "none",
      "activities": [
        { "type": "guided_demo", "fen": "8/8/8/8/3K4/8/8/8 w - - 0 1", "script": [] },
        {
          "type": "target_practice",
          "boardSize": 5,
          "piece": "K",
          "obstacles": "none",
          "generator": { "minMoves": 2, "maxMoves": 4, "rounds": 6 }
        }
      ],
      "mastery": { "type": "streak", "streak": 4 },
      "voiceover": {
        "intro": "The king is slow. One step at a time, any direction.",
        "success": "One step at a time."
      }
    },
    {
      "id": "t1-u08-pawn",
      "tier": "t1",
      "order": 8,
      "title": "The pawn only goes forward",
      "concept": "The pawn moves forward one square but captures diagonally, and it can never go back.",
      "prerequisites": ["t1-u07-king"],
      "estimatedMinutes": 6,
      "readingLevel": "none",
      "activities": [
        { "type": "guided_demo", "fen": "8/8/8/8/8/8/3P4/8 w - - 0 1", "script": [] },
        {